<?xml version="1.0" encoding="UTF-8"?>
<xs:schema xmlns:xs="http://www.w3.org/2001/XMLSchema">
    <xs:element name="grupo">
        <xs:complexType>
            <xs:sequence>
                <xs:element name="nombre" type="xs:string" />
                <xs:element name="disco" maxOccurs="unbounded">
                    <xs:complexType>
                        <xs:sequence>
                            <xs:element name="titulo" type="xs:string" />
                            <xs:element name="tema" minOccurs="0" maxOccurs="unbounded" type="xs:string" />
                            <xs:element name="aÃ±o" minOccurs="0" type="xs:string" />
                        </xs:sequence>
                    </xs:complexType>
                </xs:element>
            </xs:sequence>
        </xs:complexType>
    </xs:element>
</xs:schema>